{
  "$schema": "https://json-schema.org/draft/2020-12/schema",
  "$id": "question.schema.json",
  "title": "Question",
  "type": "object",
  "required": [
    "schema_version",
    "id",
    "revision",
    "status",
    "visibility",
    "topic",
    "kind",
    "difficulty",
    "origin",
    "prompt",
    "rubric",
    "hints",
    "follow_ups",
    "source_refs",
    "evaluation_basis",
    "created_at",
    "updated_at"
  ],
  "properties": {
    "$schema": {
      "type": "string"
    },
    "schema_version": {
      "const": 3
    },
    "id": {
      "type": "string",
      "pattern": "^q\\.[a-z0-9][a-z0-9.-]+$"
    },
    "revision": {
      "type": "integer",
      "minimum": 1
    },
    "status": {
      "enum": [
        "active",
        "archived"
      ]
    },
    "visibility": {
      "enum": [
        "public",
        "private"
      ]
    },
    "topic": {
      "type": "string",
      "minLength": 1
    },
    "kind": {
      "enum": [
        "concept",
        "explanation",
        "scenario",
        "coding",
        "system-design",
        "behavioral"
      ]
    },
    "difficulty": {
      "type": "integer",
      "minimum": 1,
      "maximum": 5
    },
    "target_roles": {
      "type": "array",
      "items": {
        "type": "string",
        "minLength": 1
      },
      "uniqueItems": true
    },
    "origin": {
      "enum": [
        "explicit-heading",
        "real-interview",
        "generated",
        "manual"
      ]
    },
    "prompt": {
      "type": "string",
      "minLength": 1
    },
    "rubric": {
      "type": "array",
      "items": {
        "type": "string",
        "minLength": 1
      }
    },
    "hints": {
      "type": "array",
      "items": {
        "type": "string",
        "minLength": 1
      }
    },
    "follow_ups": {
      "type": "array",
      "items": {
        "type": "string",
        "minLength": 1
      }
    },
    "source_refs": {
      "type": "array",
      "items": {
        "type": "object",
        "required": [
          "root",
          "path",
          "heading"
        ],
        "properties": {
          "root": {
            "type": "string",
            "minLength": 1
          },
          "path": {
            "type": "string",
            "minLength": 1
          },
          "heading": {
            "type": "string",
            "minLength": 1
          },
          "line": {
            "type": "integer",
            "minimum": 1
          },
          "unit": {
            "type": "integer",
            "minimum": 1
          },
          "unit_label": {
            "enum": [
              "document",
              "page",
              "slide",
              "sheet"
            ]
          }
        },
        "additionalProperties": false
      }
    },
    "evaluation_basis": {
      "enum": [
        "rubric",
        "source-section",
        "both"
      ]
    },
    "created_at": {
      "type": "string",
      "format": "date-time"
    },
    "updated_at": {
      "type": "string",
      "format": "date-time"
    },
    "archived_at": {
      "type": [
        "string",
        "null"
      ],
      "format": "date-time"
    },
    "archive_reason": {
      "type": [
        "string",
        "null"
      ]
    },
    "coach_notes": {
      "type": "array",
      "items": {
        "type": "string",
        "minLength": 1
      },
      "description": "Coach-only context and staged evaluation guidance; never read as the candidate prompt."
    },
    "quality_review": {
      "type": "object",
      "required": [
        "version",
        "content_sha256",
        "reviewer",
        "reviewed_at",
        "checks"
      ],
      "properties": {
        "version": {
          "const": 1
        },
        "content_sha256": {
          "type": "string",
          "pattern": "^[a-f0-9]{64}$"
        },
        "reviewer": {
          "type": "string",
          "minLength": 1
        },
        "reviewed_at": {
          "type": "string",
          "format": "date-time"
        },
        "checks": {
          "type": "object",
          "required": [
            "standalone",
            "answer_contract",
            "interview_voice",
            "scope",
            "followup_context",
            "evaluation_alignment",
            "factual_basis"
          ],
          "properties": {
            "standalone": {
              "type": "string",
              "minLength": 1
            },
            "answer_contract": {
              "type": "string",
              "minLength": 1
            },
            "interview_voice": {
              "type": "string",
              "minLength": 1
            },
            "scope": {
              "type": "string",
              "minLength": 1
            },
            "followup_context": {
              "type": "string",
              "minLength": 1
            },
            "evaluation_alignment": {
              "type": "string",
              "minLength": 1
            },
            "factual_basis": {
              "type": "string",
              "minLength": 1
            }
          },
          "additionalProperties": false
        }
      },
      "additionalProperties": false
    }
  },
  "additionalProperties": false
}
