{
  "$schema": "../../../protocol/schemas/question.schema.json",
  "schema_version": 3,
  "id": "q.spark.c4e37cba836a",
  "revision": 2,
  "status": "active",
  "visibility": "public",
  "topic": "spark",
  "kind": "system-design",
  "difficulty": 4,
  "target_roles": [
    "senior-data-engineer"
  ],
  "origin": "generated",
  "prompt": "一个 Spark 平台希望在计算节点缩容后仍能使用 Shuffle 数据。请设计计算与 Shuffle 存储分离的方案，并以 Celeborn 类远程服务为例，讨论数据推送、复制、背压、容量、故障恢复及运维成本。具体能力需注明所用服务版本。",
  "rubric": [
    "解释 Shuffle 数据与计算节点生命周期耦合带来的弹性限制",
    "分离计算与存储后明确写入、读取、元数据和恢复路径",
    "评估推送合并对小块和连接开销的作用",
    "复制与确认边界影响数据丢失和重算成本",
    "背压、负载均衡和容量水位防止服务过载",
    "比较网络开销、故障域、运维成本与已有 External Shuffle Service",
    "列式或多级存储按选定版本能力讨论，不假定所有远程服务都提供"
  ],
  "hints": [
    "画出 Executor 被移除时谁仍持有数据。",
    "为 Shuffle 服务自身失败设计恢复路径。"
  ],
  "follow_ups": [
    "远程存储成为瓶颈时怎样限制生产速度？",
    "如何比较重算成本与额外副本成本？"
  ],
  "source_refs": [],
  "evaluation_basis": "rubric",
  "created_at": "2026-08-10T21:35:29+08:00",
  "updated_at": "2026-09-20T21:46:34+08:00"
}
