{
  "$schema": "../../../protocol/schemas/question.schema.json",
  "schema_version": 3,
  "id": "q.sql.calendar-month-active-users",
  "revision": 1,
  "status": "active",
  "visibility": "public",
  "topic": "sql",
  "kind": "coding",
  "difficulty": 3,
  "target_roles": [
    "senior-data-engineer"
  ],
  "origin": "generated",
  "prompt": "访问表 visits(event_id, event_time, user_id, resource_id) 的 event_id 唯一，event_time 为 UTC；user_id 可为 NULL。写 SQL 计算最近三个完整自然月的每月活跃用户数，再为各月返回访问次数最高的三个不同名次的资源，保留并列。月份按指定业务时区计算，NULL 用户不计入活跃用户。",
  "rubric": [
    "明确当前月份起点，使用前三个月到本月起点的半开边界",
    "按业务时区自然月分组，键包含年份",
    "MAU 对非空用户去重，访问次数口径单独说明",
    "先按月和资源聚合，再按月 DENSE_RANK",
    "过滤前三档且保留并列，与恰好三行区分",
    "讨论时间转换和分区裁剪的协作",
    "测试跨年、月边界、并列和 NULL"
  ],
  "hints": [
    "先固定月份边界，再写窗口排名。",
    "排名输入应是一行一个月和资源。"
  ],
  "follow_ups": [
    "若改为包含当前未结束月份，结果如何注明可比性？",
    "缺少任何访问的月份是否应输出零，需要什么日期骨架？"
  ],
  "source_refs": [],
  "evaluation_basis": "rubric",
  "created_at": "2026-09-20T21:46:34+08:00",
  "updated_at": "2026-09-20T21:46:34+08:00"
}
