{
  "$schema": "../../../protocol/schemas/question.schema.json",
  "schema_version": 3,
  "id": "q.spark.ffd6ef1303d3",
  "revision": 1,
  "status": "active",
  "visibility": "public",
  "topic": "spark",
  "kind": "scenario",
  "difficulty": 3,
  "target_roles": [
    "spark-engineer",
    "senior-data-engineer"
  ],
  "origin": "generated",
  "prompt": "你要用 Spark 读取大量来自同一张 3000 列宽表的 Parquet 文件，作业在真正扫描数据前就很慢。你会如何验证是否由 schema merging 引起，并决定 spark.sql.parquet.mergeSchema 应该开启还是关闭？",
  "rubric": [
    "识别宽 schema、多文件 footer 扫描与 schema 比较可能造成昂贵的元数据阶段",
    "通过 Spark UI、日志、执行计划和最小文件集合区分 schema 推断、文件 listing 与实际数据扫描耗时",
    "当文件 schema 一致时关闭 mergeSchema，避免无意义的全量 schema 合并",
    "当 schema 确有演进时说明开启合并的正确性收益，并讨论显式 schema、数据重写或统一写入规范等替代方案",
    "补充列裁剪、谓词下推、文件数量与对象存储 listing 等其他可能瓶颈"
  ],
  "hints": [
    "先把元数据阶段和数据扫描阶段分开计时。"
  ],
  "follow_ups": [
    "关闭 mergeSchema 会带来什么正确性风险？",
    "如果只有少量历史分区 schema 不一致，你会怎样治理？"
  ],
  "source_refs": [],
  "evaluation_basis": "rubric",
  "created_at": "2026-08-10T21:35:29+08:00",
  "updated_at": "2026-08-10T21:35:29+08:00"
}
