{
  "$schema": "../../../protocol/schemas/question.schema.json",
  "schema_version": 3,
  "id": "q.spark.e9ad98dba094",
  "revision": 2,
  "status": "active",
  "visibility": "public",
  "topic": "spark",
  "kind": "explanation",
  "difficulty": 4,
  "target_roles": [
    "senior-data-engineer"
  ],
  "origin": "generated",
  "prompt": "以 Spark 3.5.x 的 RDD 按键排序为范围，解释如何通过采样估计范围边界、按范围重分区并在分区内排序得到全局有序结果。请分析大量重复键、采样误差、倾斜和分区数的影响，并说明怎样验证输出顺序。",
  "rubric": [
    "全局顺序需要分区间范围有序和分区内排序共同成立",
    "采样估计范围边界，样本代表性影响分区大小",
    "记录按边界进入分区，随后进行本地排序",
    "排序含采样与 Shuffle 成本，不能只用单机复杂度估计",
    "重复键与倾斜可能造成边界集中和长尾",
    "验证相邻非空分区的最大/最小键及分区内顺序，具体采样实现按版本追踪"
  ],
  "hints": [
    "先解释分区之间的先后关系从哪里来。",
    "增加分区并不保证热点键被均匀拆开。"
  ],
  "follow_ups": [
    "业务要求相同键下也稳定排序时要增加什么？",
    "采样分布与实际分布偏离时如何观察和改进？"
  ],
  "source_refs": [],
  "evaluation_basis": "rubric",
  "created_at": "2026-08-10T21:35:29+08:00",
  "updated_at": "2026-09-20T21:46:34+08:00"
}
