{
  "$schema": "../../../protocol/schemas/question.schema.json",
  "schema_version": 3,
  "id": "q.system-design.latest-state-fanout",
  "revision": 1,
  "status": "active",
  "visibility": "public",
  "topic": "system-design",
  "kind": "system-design",
  "difficulty": 4,
  "target_roles": [
    "senior-data-engineer"
  ],
  "origin": "generated",
  "prompt": "设计一个实时设备状态看板：高峰有 100 万在线用户，每人订阅 50 台设备，共有 1000 万台设备；活跃设备平均每秒更新一次，每条状态约 100 字节。看板只需最新状态，目标端到端 p99 新鲜度为两秒；审计端另需保留每次原始变化。请澄清活跃比例和热点分布，设计摄取、聚合、分发、客户端连接及恢复流程。",
  "rubric": [
    "先明确活跃设备比例、同时订阅、状态覆盖语义和审计保留要求，区分注册规模与并发负载。",
    "估算摄取量和扇出：设活跃比例为 a，输入约 1000 万乘 a 条每秒、1GB 乘 a 每秒；若所有订阅均每秒变化，输出约 5000 万条每秒、5GB 每秒载荷，另计协议、复制与冗余开销。",
    "分离原始事件持久路径、最新状态物化及连接网关，说明各层分片、订阅路由和独立扩缩容。",
    "用热点复制、分层扇出、状态合并与限速管理带宽；只在允许覆盖的状态路径合并更新，审计事件保持完整。",
    "说明客户端初始快照与增量衔接、版本去重、断线后快照恢复和过期标识；不要求回放无用的全部历史状态。",
    "比较 WebSocket、SSE 或轮询的方向性、部署和开销；心跳、退避加抖动、重订阅与鉴权需要明确设计。",
    "定义新鲜度、连接数、慢消费者队列和断连指标；对慢客户端采用有界缓存、丢弃旧状态或断连重同步。"
  ],
  "hints": [
    "分别画出必须保存的事件和允许覆盖的当前状态。",
    "沿一个热门设备到许多订阅者的路径估算网络瓶颈。"
  ],
  "follow_ups": [
    "一个设备被一半在线用户订阅，增加设备分片为什么可能没有效果？",
    "快照读取和订阅建立之间发生了更新，如何避免漏掉最终状态？",
    "通知通道断线期间最后一次更新丢了，之后设备一直不变，怎样最终恢复正确状态？"
  ],
  "source_refs": [],
  "evaluation_basis": "rubric",
  "created_at": "2026-10-02T15:17:22+08:00",
  "updated_at": "2026-10-02T15:17:22+08:00"
}
