{
  "$schema": "../../../protocol/schemas/question.schema.json",
  "schema_version": 3,
  "id": "q.soft-skill.7d02ecd6ccdd",
  "revision": 2,
  "status": "active",
  "visibility": "public",
  "topic": "soft-skill",
  "kind": "behavioral",
  "difficulty": 3,
  "target_roles": [
    "senior-data-engineer"
  ],
  "origin": "generated",
  "prompt": "你负责数据交付，但依赖团队的优先级或服务承诺与你的需求冲突，且你没有对方的管理权限。请用一次自己的经历说明如何理解双方目标、提出可验证方案、根据反馈调整、形成决定，并处理未能达成一致时的交付风险。",
  "rubric": [
    "说明双方目标、约束、责任与决策权",
    "公平解释对方担忧，以数据和试验建立讨论基础",
    "提出最小请求、分阶段方案或其他可行选项",
    "明确自己根据反馈调整了什么，也能接受对方方案更好",
    "定义 fallback、到期条件、风险与适当的升级路径",
    "区分个人行动和团队结果，以可核验结果和反思收束，不要求背诵谈判术语"
  ],
  "hints": [
    "先说双方为什么会作出各自合理的选择。",
    "回忆一个你实际修改方案的细节。"
  ],
  "follow_ups": [
    "依赖团队只能每周交付、业务需要每日结果时，怎样形成可持续契约？",
    "什么条件下应升级给双方负责人？临时方案何时退出？"
  ],
  "source_refs": [],
  "evaluation_basis": "rubric",
  "created_at": "2026-08-10T21:35:29+08:00",
  "updated_at": "2026-09-20T21:46:34+08:00"
}
