{
  "$schema": "../../../protocol/schemas/question.schema.json",
  "schema_version": 3,
  "id": "q.big-data-architecture.8f3e589a35db",
  "revision": 4,
  "status": "active",
  "topic": "big-data-architecture",
  "kind": "concept",
  "difficulty": 3,
  "target_roles": [
    "senior-data-engineer"
  ],
  "origin": "explicit-heading",
  "prompt": "企业正在业务数据库上运行分析报表。你会根据哪些业务和技术信号，判断是否需要独立的数据仓库？请结合 OLTP 与 OLAP 的访问模式说明收益、代价及暂缓建设的条件。",
  "rubric": [
    "比较事务点读写与分析扫描聚合需求",
    "以历史、多源分析、口径治理或性能证据决定建设时机",
    "比较延迟、维护和一致性代价，接受合理暂缓",
    "追问：最小数据链路和报表正确性验证可执行"
  ],
  "hints": [
    "先列出当前报表已经造成的限制。",
    "把查询资源隔离与业务指标建模分开考虑。"
  ],
  "follow_ups": [
    "如果决定建设，请给出最小可行数据链路，并说明怎样验证报表迁移正确性。"
  ],
  "source_refs": [],
  "evaluation_basis": "rubric",
  "created_at": "2026-08-05T21:54:18+08:00",
  "updated_at": "2026-10-02T21:17:53+08:00",
  "visibility": "public",
  "coach_notes": [
    "只展示主问或当前一项追问；Rubric中追问项目仅在实际提出后评价，未提出的阶段不计遗漏。"
  ],
  "quality_review": {
    "version": 1,
    "content_sha256": "b585cea97059e7a61eafc4e6f4ecff8afc8664bcc445ffd6a6ac5f33e0c9fb21",
    "reviewer": "Codex",
    "reviewed_at": "2026-10-02T21:17:51+08:00",
    "checks": {
      "standalone": "已脱离Source重读。建数仓决策与完整架构：是否建设数仓和完整摄取建模服务架构是两个独立层次，主问后半段把决策题扩成平台设计题。；现题干已修复该问题。",
      "answer_contract": "本题口径核对：企业正在业务数据库上运行分析报表。你会根据哪些业务和技术信号，判断是否需要独立的数据仓库？请结合 OLTP 与 OLAP 的访问模式说明收益、代价及暂缓建设的条件。",
      "interview_voice": "主问保留面试官提问；教练安排不混入候选人文本。需备课的事实与角色扮演约定保存在coach_notes。",
      "scope": "首问围绕建数仓决策与完整架构；后续1项逐个提出。",
      "followup_context": "已逐项核对继承条件及新增字段或执行起点：如果决定建设，请给出最小可行数据链路，并说明怎样验证报表迁移正确性。",
      "evaluation_alignment": "本次对照题干核对的评价点：比较事务点读写与分析扫描聚合需求；以历史、多源分析、口径治理或性能证据决定建设时机；比较延迟、维护和一致性代价，接受合理暂缓；追问：最小数据链路和报表正确性验证可执行。未提出的追问不计遗漏。",
      "factual_basis": "原来源保持不变；个人项目只沿用原题已记录事实；新增接口口径与角色扮演条件是练习设定。版本敏感条目要求声明所选版本并验证，不声称完成最新版本核验。"
    }
  }
}
