{
  "$schema": "../../../protocol/schemas/question.schema.json",
  "schema_version": 3,
  "id": "q.spark.22862e4ea305",
  "revision": 2,
  "status": "active",
  "visibility": "public",
  "topic": "spark",
  "kind": "scenario",
  "difficulty": 4,
  "target_roles": [
    "spark-engineer",
    "senior-data-engineer"
  ],
  "origin": "generated",
  "prompt": "一个 Spark 作业从 5 分钟退化到 45 分钟。请给出一套可重复的诊断流程：如何复现、收集 Spark UI/日志/指标、缩小问题范围、比较逻辑与物理计划、验证修复，并避免只靠反复改配置碰运气？",
  "rubric": [
    "先冻结输入、代码、依赖、集群规格和配置，建立可重复的基线与成功指标",
    "从 Spark UI 的 Job/Stage/Task、SQL Plan、shuffle、spill、GC、倾斜与 locality 收集证据",
    "结合 Driver/Executor 日志和集群指标判断是数据、计划、资源、I/O、网络还是版本回归",
    "使用二分、最小输入、局部执行、计划对比、日志/trace 或源码调试逐步排除假设",
    "一次只改变一个变量，做前后对照和多次运行，并验证正确性、性能与成本",
    "把根因、有效信号、失败尝试和预防性监控沉淀为可复用案例"
  ],
  "hints": [
    "先建立事实，再提出假设。",
    "把端到端时间拆成调度、计算、shuffle、I/O 和 GC。"
  ],
  "follow_ups": [
    "SQL 计划发生变化时，你如何定位是哪条优化规则导致？",
    "作业完成但 Spark UI 显示大量失败重试，你会如何处理？"
  ],
  "source_refs": [],
  "evaluation_basis": "rubric",
  "created_at": "2026-08-10T21:35:29+08:00",
  "updated_at": "2026-08-10T22:36:58+08:00"
}
